[
  {
    "id": "tsw.de.rapid-transit",
    "title": "Rapid Transit",
    "countries": ["DE"],
    "scopeNote": "German route.",
    "releaseVerification": "confirmed",
    "researchStatus": "pending",
    "systems": { "lineside": [], "trainProtection": [], "vigilance": [], "associated": [] },
    "routeSpecificBehaviour": [],
    "evidence": [],
    "notes": []
  },
  {
    "id": "tsw.de.ruhr-sieg-nord",
    "title": "Ruhr-Sieg Nord",
    "countries": ["DE"],
    "scopeNote": "German route.",
    "releaseVerification": "confirmed",
    "researchStatus": "pending",
    "systems": { "lineside": [], "trainProtection": [], "vigilance": [], "associated": [] },
    "routeSpecificBehaviour": [],
    "evidence": [],
    "notes": []
  },
  {
    "id": "tsw.de.main-spessart-bahn",
    "title": "Main-Spessart Bahn",
    "countries": ["DE"],
    "scopeNote": "German route.",
    "releaseVerification": "confirmed",
    "researchStatus": "pending",
    "systems": { "lineside": [], "trainProtection": [], "vigilance": [], "associated": [] },
    "routeSpecificBehaviour": [],
    "evidence": [],
    "notes": []
  },
  {
    "id": "tsw.de.rhein-ruhr-osten",
    "title": "Rhein-Ruhr Osten",
    "countries": ["DE"],
    "scopeNote": "German route.",
    "releaseVerification": "confirmed",
    "researchStatus": "pending",
    "systems": { "lineside": [], "trainProtection": [], "vigilance": [], "associated": [] },
    "routeSpecificBehaviour": [],
    "evidence": [],
    "notes": []
  },
  {
    "id": "tsw.de.hauptstrecke-rhein-ruhr",
    "title": "Hauptstrecke Rhein-Ruhr",
    "countries": ["DE"],
    "scopeNote": "German route.",
    "releaseVerification": "confirmed",
    "researchStatus": "pending",
    "systems": { "lineside": [], "trainProtection": [], "vigilance": [], "associated": [] },
    "routeSpecificBehaviour": [],
    "evidence": [],
    "notes": []
  },
  {
    "id": "tsw.de.schnellfahrstrecke-koeln-aachen",
    "title": "Schnellfahrstrecke Köln–Aachen",
    "countries": ["DE"],
    "scopeNote": "German high-speed route.",
    "releaseVerification": "confirmed",
    "researchStatus": "pending",
    "systems": { "lineside": [], "trainProtection": [], "vigilance": [], "associated": [] },
    "routeSpecificBehaviour": [],
    "evidence": [],
    "notes": []
  },
  {
    "id": "tsw.de.hauptstrecke-muenchen-augsburg",
    "title": "Hauptstrecke München–Augsburg",
    "countries": ["DE"],
    "scopeNote": "German route.",
    "releaseVerification": "confirmed",
    "researchStatus": "pending",
    "systems": { "lineside": [], "trainProtection": [], "vigilance": [], "associated": [] },
    "routeSpecificBehaviour": [],
    "evidence": [],
    "notes": []
  },
  {
    "id": "tsw.de.hamburg-luebeck",
    "title": "Hauptstrecke Hamburg–Lübeck",
    "countries": ["DE"],
    "scopeNote": "German route.",
    "releaseVerification": "confirmed",
    "researchStatus": "pending",
    "systems": { "lineside": [], "trainProtection": [], "vigilance": [], "associated": [] },
    "routeSpecificBehaviour": [],
    "evidence": [],
    "notes": []
  },
  {
    "id": "tsw.de.dresden-riesa",
    "title": "Nahverkehr Dresden (Dresden–Riesa)",
    "countries": ["DE"],
    "scopeNote": "Priority audit route for modern and former Deutsche Reichsbahn signalling.",
    "releaseVerification": "confirmed",
    "researchStatus": "in-progress",
    "systems": { "lineside": [], "trainProtection": [], "vigilance": [], "associated": [] },
    "routeSpecificBehaviour": [],
    "evidence": [],
    "notes": ["First audit group."]
  },
  {
    "id": "tsw.de.dresden-chemnitz",
    "title": "Tharandter Rampe (Dresden–Chemnitz)",
    "countries": ["DE"],
    "scopeNote": "Priority audit route for modern and former Deutsche Reichsbahn signalling.",
    "releaseVerification": "confirmed",
    "researchStatus": "in-progress",
    "systems": { "lineside": [], "trainProtection": [], "vigilance": [], "associated": [] },
    "routeSpecificBehaviour": [],
    "evidence": [],
    "notes": ["First audit group."]
  },
  {
    "id": "tsw.de.kassel-wuerzburg",
    "title": "Schnellfahrstrecke Kassel–Würzburg",
    "countries": ["DE"],
    "scopeNote": "German high-speed route.",
    "releaseVerification": "confirmed",
    "researchStatus": "pending",
    "systems": { "lineside": [], "trainProtection": [], "vigilance": [], "associated": [] },
    "routeSpecificBehaviour": [],
    "evidence": [],
    "notes": []
  },
  {
    "id": "tsw.de.bremen-oldenburg",
    "title": "Bahnstrecke Bremen–Oldenburg",
    "countries": ["DE"],
    "scopeNote": "German route.",
    "releaseVerification": "confirmed",
    "researchStatus": "pending",
    "systems": { "lineside": [], "trainProtection": [], "vigilance": [], "associated": [] },
    "routeSpecificBehaviour": [],
    "evidence": [],
    "notes": []
  },
  {
    "id": "tsw.de.linke-rheinstrecke",
    "title": "Linke Rheinstrecke (Mainz–Koblenz)",
    "countries": ["DE"],
    "scopeNote": "Historical-era German route.",
    "releaseVerification": "confirmed",
    "researchStatus": "pending",
    "systems": { "lineside": [], "trainProtection": [], "vigilance": [], "associated": [] },
    "routeSpecificBehaviour": [],
    "evidence": [],
    "notes": []
  },
  {
    "id": "tsw.de.niddertalbahn",
    "title": "Niddertalbahn",
    "countries": ["DE"],
    "scopeNote": "Historical-era German route.",
    "releaseVerification": "confirmed",
    "researchStatus": "pending",
    "systems": { "lineside": [], "trainProtection": [], "vigilance": [], "associated": [] },
    "routeSpecificBehaviour": [],
    "evidence": [],
    "notes": []
  },
  {
    "id": "tsw.de.maintalbahn",
    "title": "Maintalbahn",
    "countries": ["DE"],
    "scopeNote": "German route.",
    "releaseVerification": "confirmed",
    "researchStatus": "pending",
    "systems": { "lineside": [], "trainProtection": [], "vigilance": [], "associated": [] },
    "routeSpecificBehaviour": [],
    "evidence": [],
    "notes": []
  },
  {
    "id": "tsw.de.frankfurt-fulda",
    "title": "Frankfurt–Fulda (Kinzigtalbahn)",
    "countries": ["DE"],
    "scopeNote": "Priority for LZB, GNT/NeiTech and timetable-layer research.",
    "releaseVerification": "confirmed",
    "researchStatus": "pending",
    "systems": { "lineside": [], "trainProtection": [], "vigilance": [], "associated": [] },
    "routeSpecificBehaviour": [],
    "evidence": [],
    "notes": []
  },
  {
    "id": "tsw.de.pfaelzische-ludwigsbahn",
    "title": "Pfälzische Ludwigsbahn",
    "countries": ["DE"],
    "scopeNote": "German route.",
    "releaseVerification": "confirmed",
    "researchStatus": "pending",
    "systems": { "lineside": [], "trainProtection": [], "vigilance": [], "associated": [] },
    "routeSpecificBehaviour": [],
    "evidence": [],
    "notes": []
  },
  {
    "id": "tsw.de.frankfurt-s-bahn",
    "title": "Frankfurt S-Bahn",
    "countries": ["DE"],
    "scopeNote": "German urban route candidate.",
    "releaseVerification": "pending",
    "researchStatus": "pending",
    "systems": { "lineside": [], "trainProtection": [], "vigilance": [], "associated": [] },
    "routeSpecificBehaviour": [],
    "evidence": [],
    "notes": ["Confirm official release identity and title before auditing."]
  },
  {
    "id": "tsw.de.leipzig-dresden",
    "title": "Bahnstrecke Leipzig–Dresden",
    "countries": ["DE"],
    "scopeNote": "Priority audit route; expected to overlap with or extend Dresden-area content.",
    "releaseVerification": "pending",
    "researchStatus": "in-progress",
    "systems": { "lineside": [], "trainProtection": [], "vigilance": [], "associated": [] },
    "routeSpecificBehaviour": [],
    "evidence": [],
    "notes": ["Confirm official release identity and relationship to Dresden–Riesa."]
  },
  {
    "id": "tsw.de.frankenbahn",
    "title": "Frankenbahn (Stuttgart–Heilbronn)",
    "countries": ["DE"],
    "scopeNote": "German route candidate.",
    "releaseVerification": "pending",
    "researchStatus": "pending",
    "systems": { "lineside": [], "trainProtection": [], "vigilance": [], "associated": [] },
    "routeSpecificBehaviour": [],
    "evidence": [],
    "notes": ["Confirm official release identity and title before auditing."]
  },
  {
    "id": "tsw.at-de.s-bahn-vorarlberg",
    "title": "S-Bahn Vorarlberg",
    "countries": ["AT", "DE"],
    "scopeNote": "Include German signalling and safety-system transition around Lindau.",
    "releaseVerification": "confirmed",
    "researchStatus": "pending",
    "systems": { "lineside": [], "trainProtection": [], "vigilance": [], "associated": [] },
    "routeSpecificBehaviour": [],
    "evidence": [],
    "notes": []
  },
  {
    "id": "tsw.at-de.salzburg-rosenheim",
    "title": "Bahnstrecke Salzburg–Rosenheim",
    "countries": ["AT", "DE"],
    "scopeNote": "Include German running and the Austrian endpoint/transition.",
    "releaseVerification": "confirmed",
    "researchStatus": "pending",
    "systems": { "lineside": [], "trainProtection": [], "vigilance": [], "associated": [] },
    "routeSpecificBehaviour": [],
    "evidence": [],
    "notes": []
  },
  {
    "id": "tsw.de-at.mittenwaldbahn",
    "title": "Mittenwaldbahn",
    "countries": ["DE", "AT"],
    "scopeNote": "German/Austrian cross-border route.",
    "releaseVerification": "confirmed",
    "researchStatus": "pending",
    "systems": { "lineside": [], "trainProtection": [], "vigilance": [], "associated": [] },
    "routeSpecificBehaviour": [],
    "evidence": [],
    "notes": []
  }
]
